[
  {"id":"sec-boundary-1","kind":"POLICY_CHECK","scope":"SECURITY_EXAMPLE","time":{"clock":"MONO","t":1},"props":{"example":"synthetic","result":"fail_closed"}},
  {"id":"sec-boundary-2","kind":"ARTIFACT_CLOSED","scope":"PFK","time":{"clock":"MONO","t":2},"props":{"claim_class":"operational","non_claim":"not exploit guidance"}}
]
